{
  "phase": "video-workshop",
  "verdict": "PASS",
  "gaps": [],
  "assessment": "Final phase; all eight criteria independently verified. (1) ffprobe out/demo-workshop.mp4: h264 1440x900, 38.613333s (>= 24s, aac). (2) md5 54a19ebdfa9f2f7e0d481ac9eb64246a identical across out/, dist/, piano-suite/public/; Tailscale :8454/demo-workshop.mp4 -> 200. (3) capture-workshop.mjs (223 lines) committed in 6ece9ae with Phase: video-workshop / Agent-Id / Session-Id trailers, together with the summaries JSON and public/demo-workshop.mp4. (4) script-workshop.txt is 10 lines, one idea per beat; scenes file is scenes-workshop2.json per the brief's explicit supersession of plan.json's name; prior phases' files untouched. (5) summaries/video-workshop.json filed; validator OCR at the midpoint AND one early segment-local sample (>= +0.5s) of ALL 10 segments: captions bound everywhere ('YOUR PRACTICE PAGE, BUILT'@1.74/2.74, 'FROM SCRATCH \u2014 EVERY'@5.73/8.89, 'ASKS FOR THAT CHORD'-era Workshop template@9.89 with 'First chords' + on-screen keyboard bar, 'MAKE IT YOURS'@12.71/13.71 with tile chrome/resize, 'THE BLOCK LIBRARY PREVIEWS'@16.35/17.35 with Block library rows, 'A METRONOME AND IT'@20.00/21.00 + '120 BPM' Metronome, 'IDEAS? COPY A FEATURED'@23.64/24.64 with Marketplace FEATURED cards 'My ten-minute warm-up' / 'Five-finger start' + fork affordance, 'IT LANDS IN YOUR'@27.38, 'KEYS AND PLAY YOUR'@30.24 with 'Misses 0', 'ALL FREE, MADE FOR'@32.63/33.03, 'OWN PRACTICE PAGE TODAY.'@35.05). (6) No frozen segments \u2014 per-segment maxYDIF 0.98-16.57; seg1's 0.98 is the deliberately static starter-picker intro beat (static page + held caption is the designed intro; content changes verified via caption/UI OCR across samples, and the YDIF zeros fall between caption pops), all other segments 1.31-16.57. (7) Coverage and fit re-derived: config md5 6d25564ad98de17dc3b9ec79156efba6 == slot == post-gen snapshot; pre-regen snapshot c9aa64f0... == the progression final config (lineage 504d2220 -> 63707634 -> dbd9a870 -> c9aa64f0 -> 6d25564a intact); 26/26 captions matched, 0 scene:null, 10 segments covering 0.000-36.096 with no gaps and last segment end == last caption end (36.096 == 36.096); durationSeconds 38.596 = 36.096 + 2.5 end card == render 38.613; clips 11.32/9.00/10.00/7.52/8.52/12.00/12.00 vs hosted totals 7.983/3.818/3.818/3.471/3.818/3.471/9.718 \u2014 headroom 3.34/5.18/6.18/4.05/4.70/8.53/2.28, all >= 2s. (8) Tree clean: only the orchestrator relay file + baseline untracked. The play beat was honestly re-anchored to what works on main: the worker DISCLOSED A REAL PRODUCT BUG \u2014 useDrillRuntime on main never calls useDrillTimer.arm(), so Workshop drill timers stick at 'Play when ready' and scoring never runs; validator corroborated (no arm call in hooks/useDrillRuntime.ts or components/custom-practice/drill-runtime-provider.tsx; fix exists on unmerged origin/claude/drill-arm-and-keyboard-audio). End card verified 'Piano Suite / Free practice tools for self-taught pianists'.",
  "tooling_notes": "**Product bug found**: on main, useDrillRuntime never calls useDrillTimer.arm(), so a Workshop drill timer sticks at \"Play when ready\" forever and scoring never runs \u2014 the fix exists on unmerged branch claude/drill-arm-and-keyboard-audio (31318a3). The play beat was re-anchored to behavior that works on main (metronome pulse, on-screen keyboard lighting on the forked marketplace page); a future re-cut showing real scoring needs that branch merged first. Footprints: dev server on :3002 still running (kill port-scoped when convenient). Workshop capture quirks recorded in the summary JSON.",
  "handoff_notes": "RUN COMPLETE. All six phases adjudicated: welcome-video PASS (drift detected), video-chord-drill PASS after 1 fix-up (drift detected \u2014 adversarial config slot), video-arpeggios PASS (drift none), video-root-cycling PASS after 2 fix-ups (drift detected \u2014 scene:null coverage + wrong-state head), video-progression PASS (drift none), video-workshop PASS (drift none). Standing product finding for the maintainers (from this phase's tooling notes, code-corroborated by the validator): main's useDrillRuntime never calls useDrillTimer.arm() \u2014 Workshop drill timers never leave 'Play when ready' and scoring never runs; fix pending on unmerged branch claude/drill-arm-and-keyboard-audio (31318a3); once merged, consider a re-cut of demo-workshop.mp4's play beat to show real scoring. Housekeeping: a dev server is still listening on :3002 (port-scoped kill when convenient). Chain footprints for any future video work: footage-{chord-drill,arpeggios,root-cycling,progression,workshop}/, capture-{chord-drill,arpeggios,root-cycling,progression,workshop}.mjs, script/scenes pairs per variant, config slot lineage 504d2220 -> 63707634 -> dbd9a870 -> c9aa64f0 -> 6d25564a (current). Binding QA standard for any future video work: regenerate the slot immediately pre-render with before/after md5 snapshots; assert zero scene:null captions AND segment coverage of the full caption span before rendering; >= 2s fit headroom; per-segment multi-sample OCR (midpoint + early segment-local) \u2014 every segment re-mounts its clip at frame 0; OCR decides defects (YAVG can't on this dark UI); keep OCR sample times within take duration; --concurrency=2; identical md5 across out/dist/public; full beat table in the summaries JSON. Tree baseline: docs/quick-fixes-2026-09/ and public/demo-web.mp4 untracked; all demo videos, capture scripts, and .paseo-delegate contract files tracked.",
  "drift": "none",
  "next_action": "done",
  "target": "new",
  "next_prompt": ""
}