{
  "phase": "blocks-api-route",
  "verdict": "PASS",
  "gaps": [],
  "assessment": "Independently verified in /home/justin/piano-suite/.worktrees/fleet-agent-surface. AC 1: my own production build plus my own `next start`/curl on sanctioned port 3355 reproduced HTTP 200, content-type application/json, cache-control 'public, max-age=3600, stale-while-revalidate=86400', and a body of 20 components every one carrying exactly the 10 static keys incl. configSpec (allKeysExact=true, configSpecAllArrays=true) — verified server-side, no stray process or dirty file left behind. AC 2: the policy (deliberately public, with why) is stated in both the route doc comment and the auth module; `auth()` is awaited and routed through the pure `authorizeBlocksApiAccess` in lib/blocks-api-auth.ts, which faithfully mirrors lib/chat-auth.ts's shape (doc comment, exported decision type, {userId} pure function); unit tests cover anonymous, signed-in, and identity-independence branches; chat-auth.ts and app/api/chat/route.ts are untouched (commit stat confirms). AC 3: durable unit test asserts components.length === listManifests().length and per-component kind/accepts/outputs/requires/configSpec, plus a byte-identical-across-calls determinism test that directly answers the spec's 'leaks something private' risk; my curl independently confirmed 20 components served. The configSpec discrepancy was resolved via brief-sanctioned option (a) — a single serializer line (`configSpec: m.configSpec`), no registered content changed, registry-parity green (17 tests) in my targeted run, resolution stated in HANDOFF NOTES as the brief required. Full gate re-run by me: lint exit 0 (0 errors, 12 pre-existing warnings), test:unit:run 150 files / 1396 passed (>= 1349, 0 failures), build exit 0 with /api/blocks present in .next/app-path-routes-manifest.json. Provenance: commit eba02f3 on fleet/agent-surface scoped to exactly the five declared paths, all five trailers present and matching the executing worker identity relayed by the orchestrator (provider swap mid-phase was operator-ordered; trailer ids correctly identify the commit's author session), tree clean, no repo created, no push/PR, no npm ci/install, hotspot files untouched. Solid: minimal serializer surface change, honest accounting of the predecessor split (predecessor work verified file-by-file before reuse). Fragile: the decision type is a single-member union ('ok'), so the spec's 'both branches' wording is satisfied in the input-space sense only — the route's 403 branch is shape-required but unreachable, explicitly documented with a widening path if policy ever tightens; and the 1h/SWR-86400 cache means catalogue changes propagate slowly, acceptable only because the body is deploy-time-static (which the determinism test pins).",
  "tooling_notes": "(1) Every shell command prints `ERROR: ld.so: object '/usr/NX/lib/libnxegl.so' from LD_PRELOAD cannot be preloaded` to stderr first — harmless, ignored per the brief. (2) The brief warns the worktree's node_modules is an empty directory with deps/docs in the main checkout; in practice npx vitest/eslint/tsc/next and npm run * all executed fine from the worktree. (3) Project-wide `tsc --noEmit` surfaces pre-existing errors in unrelated test files (audio-storage, custom-practice-storage, feature-block-schemas, registry-parity provides/maxPerPage, music-player) — known since phase 1, not surfaced by the gate; scoped grep confirms none touch this phase. (4) `npm run build` is the slowest gate step (minutes); it is where the predecessor's session limit hit — no defect in the build itself.",
  "handoff_notes": "For editor-wiring-notice: (1) describeRegistryForAgent() output now includes configSpec on every component (option (a)) — the serialised catalogue shape is 10 keys per component: type, kind, label, summary, justification, accepts, outputs, requires, configSpec, status; any plan-doc example predating this is stale. (2) RE-FLAGGED DRIFT, now directly in your path: docs/stage-2/phase-2.5-agent-surface/PLAN.md's Step-3 mapping table still lists the removed `unconsumed_output` row — map ONLY `unmet_requirement` and `orphan_transform` (WiringIssue['issue'] is a two-member union since phase 1). (3) ArrangementResult's valid branch carries no `issues` key — discriminate on `status`, never `issues.length`. (4) GET /api/blocks exists as a public catalogue with cache-control max-age=3600/swr=86400 — if the editor UI ever consumes it client-side, treat it as deploy-time-static. (5) Pre-existing tsc --noEmit errors in unrelated test files remain (phase-1 finding); the gate does not surface them. (6) Run bookkeeping: this phase's commit trailers carry the executing zai/glm-5.3-flash worker's ids per the operator-ordered provider swap; the run ledger's claude ids for the original spawn are historical only. (7) The commit's Verdict trailer names .paseo-delegate/agent-surface/verdicts/blocks-api-route.json — that artefact is the validator's/orchestrator's to place, not a missing worker deliverable.",
  "drift": "detected",
  "next_action": "advance",
  "target": "new",
  "next_prompt": ""
}
