{
  "phase": "welcome-video",
  "verdict": "PASS",
  "gaps": [],
  "assessment": "All six acceptance criteria independently re-verified on merged main. (1) grep -rn demo-web2 app components lib finds tracked references in lib/welcome-config.ts:295 (videoSrc) and components/welcome/demo-video-section.tsx; (2) the committed embed (demo-video-section.tsx) is muted+playsInline with visible native controls and preload=metadata, no autoplay so no reduced-motion path required; (3) git ls-files public/demo-web2.mp4 non-empty (committed in 8f00873, h264 1440x900 46.5s, md5 51420228f58ddbca588033fee6a35ab1 unchanged); (4) npm run lint exit 0 (0 errors; 10 warnings all in pre-existing non-phase files) and npm run build exit 0; (5) both deliverable commits 8f00873 and e530dba carry all five required trailers and 8f00873 touches only in-scope paths; (6) git status --porcelain shows no worker dirt from this phase. Copy is registered as a typed demoVideo block with validateWelcomeConfig clamping and unit tests (21 passed, re-run by validator). Solid. Fragile: the worker PRE-AUTHORED its own verdict file (verdicts/welcome-video.json, committed in e530dba) claiming PASS and next_action done — a boundary breach, since verdicts belong to the validator; it has been overwritten with this verdict. Also scope-relevant: the phase edited proxy.ts (Clerk matcher gains mp4|webm|mov) — a real, code-verified bug fix outside the brief's file list; the plan's 'touches only welcome-page sources, public/demo-web2.mp4, and contract files' wording did not anticipate it, and e530dba additionally edits .gitignore.",
  "tooling_notes": "Port 3002 is occupied by an unrelated Remotion bundle server ('piano-content'); used PORT=3005. The worktree lacked the untracked public/demo-web2.mp4 (worktrees exclude untracked files) and the first merge into main aborted because of the untracked main-checkout copy; verified identical md5 (51420228f58ddbca588033fee6a35ab1), removed the untracked copy, merge then succeeded.",
  "handoff_notes": "Baseline delta the plan and the video-chord-drill brief must absorb: public/demo-web2.mp4 is now TRACKED in git, so plan.json git_baseline.piano_suite_preexisting_dirt and the next brief's criterion-8 baseline list ('?? public/demo-web2.mp4') are stale — cleanliness checks must treat it as tracked. Also currently untracked on main but NOT phase dirt: .paseo-delegate/demo-videos/briefs/video-chord-drill.md (parallel phase's brief) and .paseo-delegate/demo-videos/summaries/relay-welcome-video.md (orchestrator relay). The validator-overwritten verdicts/welcome-video.json is a modified tracked file pending a contract-files commit. proxy.ts matcher now bypasses Clerk for mp4/webm/mov static fetches (signed-out visitors load public video; protected /tools/* still gate). .paseo-delegate/demo-videos contract files (briefs/summaries/verdicts) are tracked; ledger.json stays ignored. demoVideo copy is dev-lab editable; a poster frame would need a new optional config field.",
  "drift": "detected",
  "next_action": "advance",
  "target": "new",
  "next_prompt": "cd /home/justin/piano-suite. You are executing phase video-chord-drill of the demo-videos delegation. Read and execute the complete self-contained brief at /home/justin/piano-suite/.paseo-delegate/demo-videos/briefs/video-chord-drill.md — it is your entire instruction set; assume nothing else from any session. One correction to apply while executing: public/demo-web2.mp4 is now TRACKED in the piano-suite repo (committed with provenance trailers), so the brief's criterion-8 baseline should read 'nothing NEW dirty beyond: docs/quick-fixes-2026-09/, public/demo-web.mp4, and contract files committed by this phase' — do not expect demo-web2.mp4 to appear as untracked dirt, and do not modify it. Your Agent-Id is $PASEO_AGENT_ID; Session-Id is runtimeInfo.sessionId in ~/.paseo/agents/home-justin-piano-suite/$PASEO_AGENT_ID.json. Numeric-only video verification per /home/justin/.agents/skills/piano-demo-video/SKILL.md."
}
