{
  "phase": "editor-wiring-notice",
  "verdict": "PASS",
  "gaps": [],
  "assessment": "Independently verified in /home/justin/piano-suite/.worktrees/fleet-agent-surface. AC 8: wiring-notice.test.tsx renders the real PracticePageEditor against seeded stores and asserts, per tile (data-tile-id pre-existed at workshop-tile.tsx:191, not added by this commit), that an unmet-requirement page names the problem in plain language ('Add a source block (like the chord library)...') and an orphan-transform page shows the spec's verbatim orphan sentence — both via getByTestId('tile-wiring-notice') within the specific tile. AC 9: a fully wired page (chordLibrary + rhythmPattern) renders zero notices, asserted by testid count and negative text queries. Binding drift correction honoured: wiringNotice() handles exactly orphan_transform + unmet_requirement; grep -rn 'unconsumed_output' over lib app components convex returns nothing (S2); the raw enum is asserted absent from the DOM by a dedicated test. The detail-string switch is grounded: manifest.ts:709 emits 'Requires: <req>' and the registry's real requires values are only practiceNotes and midiInput (both mapped; the transport case is defensive for a requires value no current block declares — the plain-language default catches anything else, so no enum can leak). S1: ValidatedBlock gains size?: BlockSize (imported from lib/workshop-grid, not edited) and the new test's annotated read `const size: BlockSize | undefined = block?.size` compiles — my own `tsc --noEmit` shows zero errors in every file this phase touched; the only family error remains the pre-existing, byte-identical workshop-grid.test.tsx:169 in an untouched file, and feature-block-schemas.test.ts (previously tsc-dirty) is now clean, which independently corroborates the worker's TOOLING NOTES observation. Theme compliance: notice uses border-border/bg-muted/30/text-muted-foreground tokens, no hex/rgb. Guidance-not-enforcement honoured: block content renders unconditionally, no save-path logic touched, Map<blockId, WiringIssue[]> passed once through GridBody→WorkshopTile, ArrangementResult discriminated on status (never issues.length), grid props optional so behaviour is unchanged for non-editor callers (the sole production caller is the editor). PR #95 overlap is conflict-trivial as claimed: one extended import line plus a self-contained EOF describe block. Full gate re-run by me: lint exit 0 (0 errors, 12 pre-existing warnings), test:unit:run 151 files / 1401 passed (>= 1349, 0 failures), build exit 0. Provenance: commit bfe9dfd on fleet/agent-surface scoped to exactly the six declared paths, all five trailers complete and matching the relayed worker identity, tree clean, no push/PR, no hotspot/proxy/lib-workshop-grid/manifest/validate-arrangement edits, no AGENTS.md edit (correctly deferred to the final phase). A11y: notice markup is plain <p> text with theme tokens, no new roles, guidance not color-signalled; credible zero-serious/critical risk for the axe gate, subject to the final phase's e2e re-run. Solid: minimal plumbing, honest reporting including a tool-layer write truncation it immediately retried. Fragile: the unmet-requirement sentences are keyed to today's three detail strings, so a new requires value silently falls to the generic default — acceptable, still plain language.",
  "tooling_notes": "One run-command truncation on my side (first write_file payload for workshop-tile.tsx was cut mid-JSON by the tool layer; retried immediately and the full file landed — no partial file ever hit disk). The brief's warning about a pre-existing tsc error in feature-block-schemas.test.ts no longer manifests: no tsc error is currently reported in that file. The worktree-wide `tsc --noEmit` count is 49 pre-existing errors (test files only; the known workshop-grid.test.tsx:169 error is byte-identical at base commit eba02f3) — my LD_PRELOAD stderr noise appeared on every command, as briefed; harmless.",
  "handoff_notes": "For finish-gate-and-pr: (1) AGENTS.md still needs this phase's primitives-table rows/convention note — the spec's definition-of-done expects entries for the wiring-notice behaviour (WorkshopTile guidance notice, issuesByBlockId Map contract) and the phase-1/2 artefacts (lib/feature-blocks/validate-arrangement.ts, app/api/blocks/route.ts, lib/blocks-api-auth.ts); no docs file has been edited by any phase yet. (2) Re-run the a11y e2e per plan; the notice is theme-token plain text with no new roles, so zero serious/critical is expected — if you want explicit proof of the notice markup under axe, seed an invalid page on /tools/workshop for a spot-check, otherwise the standard gate suffices. (3) The Verdict trailer of bfe9dfd names .paseo-delegate/agent-surface/verdicts/editor-wiring-notice.json — that is this file. (4) PR #95 overlap: this phase extended lib/__tests__/feature-block-schemas.test.ts (one import line + EOF describe block); expect at most a trivial import-line merge. (5) Standing corrections already in the code: WiringIssue union is two-member (unmet_requirement | orphan_transform) — the spec doc's stale unconsumed_output row (PLAN.md ~192) and three-member prose (~70) remain unedited read-only drift for any future spec revision. (6) Pre-existing tsc --noEmit errors persist in unrelated test files (now 49, all test files); feature-block-schemas.test.ts is no longer among them. (7) /api/blocks (phase 2) is public, deploy-time-static; nothing in the editor fetches it — wiring validation is local and synchronous via validateArrangement.",
  "drift": "none",
  "next_action": "advance",
  "target": "new",
  "next_prompt": ""
}
