{
  "phase": "repo-hygiene",
  "verdict": "PASS",
  "gaps": [],
  "assessment": "Solid: every criterion is git state I verified directly, not self-report. `git status --porcelain` is empty at /home/justin/piano-suite; `git status -sb` shows `## main...origin/main` with HEAD == origin/main at 97a45be and 0 unpushed commits. The range diff ff14615..97a45be touches exactly two files: docs/quick-fixes-2026-09/PLAN.md (176 insertions, 946a6b3) and .gitignore (+3 lines, 97a45be). PLAN.md was committed untouched \u2014 its on-disk mtime (Sep 12 14:54) predates the phase and the directory holds only that file. public/demo-web.mp4 still exists on disk (4163805 bytes), `git log --all -- public/demo-web.mp4` returns nothing, and `git check-ignore -v` proves the new `/public/demo-web.mp4` entry is what ignores it. Both deliverable-changing commits carry all five required trailer lines (Phase/Agent-Id/Session-Id/Brief/Verdict); `Agent-Id: unknown` / `Session-Id: unknown` is the brief's explicit fallback and ledger.json independently preserves the real ids (69bda67c\u2026 / d0c605b7\u2026). The brief's no-worktree instruction was followed; no new repository was created. Fragile: the provenance trailers read `unknown`, so the commits alone don't identify the worker \u2014 only the ledger does; and `.gitignore` ignores only this one mp4, so a future renamed demo video would resurface as untracked bloat.",
  "tooling_notes": "none",
  "handoff_notes": "Deltas the final phase must absorb: (1) the tree is fully clean at 97a45be \u2014 launch-smoke starts from a pristine checkout and docs/quick-fixes-2026-09/ is now tracked, so the report file can be added and committed inside it directly. (2) The project's e2e invocation is `npm run test:e2e` (playwright test, testDir ./e2e, baseURL http://localhost:$E2E_PORT, webServer defined in playwright.config.ts) \u2014 the plan's `npm run test:e2e -- a11y` correctly filters to e2e/a11y.spec.ts; the worker should read playwright.config.ts for the server/port setup and may need `npx playwright install chromium`. (3) Repeat of the phase-1 tooling note so it is not mistaken for a defect: the shell emits harmless LD_PRELOAD libnxegl warnings on every invocation (environment artifact, not this work). (4) Orchestrator note, not a phase defect: this worker's trailers read `Agent-Id: unknown` / `Session-Id: unknown` because no spawn-context ids reached it \u2014 backfill awareness for the run record; ledger.json has the authoritative ids.",
  "drift": "none",
  "next_action": "advance",
  "target": "new",
  "next_prompt": "# Task\nRun the full launch gate plus the signed-out accessibility e2e spec in /home/justin/piano-suite, and write the launch-readiness report to `docs/quick-fixes-2026-09/launch-smoke-2026-09-16.md`. This is an analysis-only phase: the report is the only file you write.\n\nFirst run: `cd /home/justin/piano-suite`\n\n# Context\nPiano Suite (Next.js 16 + Convex + Clerk) is being prepped for a free-tester launch. This is phase 3 of a three-phase launch-prep run. Phases 1\u20132 are merged and pushed: main is at 97a45be (phase 1 added app/robots.ts, app/sitemap.ts, app/not-found.tsx and the root title.template; phase 2 committed docs/quick-fixes-2026-09/ and gitignored public/demo-web.mp4). The tree is clean. Your verdict decides ready / not ready.\n\n# Relevant files\n- `/home/justin/piano-suite/package.json` \u2014 scripts: `lint`, `test:unit:run`, `build`, `test:e2e` (playwright).\n- `/home/justin/piano-suite/playwright.config.ts` \u2014 e2e testDir `./e2e`, `baseURL: http://localhost:$E2E_PORT`, webServer setup; read it before running e2e.\n- `/home/justin/piano-suite/e2e/a11y.spec.ts` \u2014 the signed-out accessibility spec to run.\n- `/home/justin/piano-suite/docs/quick-fixes-2026-09/` \u2014 tracked directory; the report lands here.\n- `/home/justin/piano-suite/AGENTS.md` \u2014 project conventions.\n\n# Output format\nOne new file, `/home/justin/piano-suite/docs/quick-fixes-2026-09/launch-smoke-2026-09-16.md`, containing:\n1. The exact commands you ran (lint, unit, build, e2e), in order.\n2. Pass/fail per suite, with the real numbers (e.g. test counts, warnings).\n3. Verbatim failure output for any suite that failed \u2014 do not paraphrase or trim errors.\n4. A short closing section: \"ready\" or \"not ready\" for free-tester launch, with one or two sentences of justification.\nThen commit that file to `main` and push to `origin/main`.\n\n# Tool and source guidance\n- Run the gate: `npm run lint`, `npm run test:unit:run`, `npm run build`.\n- For e2e: `npx playwright install chromium` if the browser is missing, then `npm run test:e2e -- a11y`. Read playwright.config.ts first to learn how the web server is started and whether E2E_PORT must be set; use the project's documented invocation, and record in the report exactly what you ran.\n- Work directly in `/home/justin/piano-suite`. Do NOT create a git worktree: the report path lives in the main checkout. Scope `git add` to the report file only \u2014 never `git add -A`.\n- Write the report incrementally as each suite finishes, so a crash cannot lose results.\n- If a suite fails, do NOT fix anything: record the failure verbatim and write \"not ready\" if warranted. A truthful failing report passes this phase; a broken gate is a finding, not your defect.\n- Shell noise note: this machine's shell emits harmless `LD_PRELOAD` libnxegl warnings on every invocation \u2014 environment artifact, not a gate failure.\n\n# Task boundaries\n- DO NOT edit any application source file, config, or test. The only file you create is the report.\n- Do not touch `public/demo-web.mp4` or `.gitignore`.\n- No new dependencies; no new git repository; no force-push.\n\n# Effort budget\n~45 minutes. If blocked past that, report STATUS: blocked.\n\n# Acceptance criteria\n- [ ] `/home/justin/piano-suite/docs/quick-fixes-2026-09/launch-smoke-2026-09-16.md` exists and records real command output \u2014 the validator will re-run at least `npm run lint` and `npm run test:unit:run` and compare against the recorded results.\n- [ ] All four suites (lint, unit, build, e2e a11y) were actually run, each with its outcome recorded; failures appear verbatim.\n- [ ] The report ends with an explicit \"ready\" or \"not ready\" conclusion.\n- [ ] No application source files were modified: the phase's commit(s) touch only the report file, and `git status --porcelain` is empty after the push.\n- [ ] The report commit is on `main`, pushed (`git status -sb` shows `## main...origin/main` with no ahead/behind), and carries the provenance trailers below.\n\n# Constraints\nEvery deliverable-changing commit message ends with these trailers (fill in your agent id and session id from your spawn context; write `unknown` if truly unavailable):\n\n```\nPhase: launch-smoke\nAgent-Id: <your paseo agent id>\nSession-Id: <your session id>\nBrief: .paseo-delegate/briefs/launch-smoke.md\nVerdict: .paseo-delegate/verdicts/launch-smoke.json\n```\n\n# Completion contract\nYour final chat message must be your completion summary:\nSTATUS: complete|blocked|failed\nSUMMARY: ...\nFILES CHANGED: ...\nVERIFICATION: ... (exact commands run and their results)\nBLOCKERS: ...\nTOOLING NOTES: ... (defects/surprises in the tools themselves \u2014 the CLI, the test harness, the build \u2014 distinct from your own work; \"none\" if none)\nHANDOFF NOTES: ..."
}
