{
  "phase": "docs-accuracy",
  "verdict": "PASS",
  "gaps": [],
  "assessment": "Independently verified; not taken from the worker's report. Substance: every factual claim behind the six edits checks out against ground truth — old paths (docs/missing-features-plan.md, docs/phase-a-auth-cutover-plan.md, docs/subscription-page-plan.md, docs/overhaul-plan.md) are absent from origin/main (git cat-file), the archive targets exist and the files were moved not deleted (git log --follow), DESIGN-PRINCIPLES.md is at repo root, ff14615 (2026-09-16) shipped app/robots.ts + app/sitemap.ts + app/not-found.tsx + title.template in app/layout.tsx (line 51) and the new 'Status: executed 2026-09-16' matches the file's existing Phase 0 style (line 143), e2e/home-mobile.spec.ts matches /come on in/i with zero 'enter the workshop' references, lib/welcome-config.ts:153 has ctaText: 'Come on in', and proxy.ts makes /start and /tools/workshop public. Mechanical checks re-run by me: my own link sweep (38 files, 61 relative links, 0 broken), grep 'enter the workshop' -i docs/ e2e/ matches only docs/archive/, diff vs origin/main touches exactly 6 files all under docs/, diff -- docs/archive/ is empty, tree clean. Gate re-run by me in the worktree: lint 0 errors (12 pre-existing warnings, none in touched files), test:unit:run 147 files / 1349 passed / 0 failures, build exit 0. Provenance: single commit f340a82, HEAD == origin/fleet/docs-accuracy, PR #94 OPEN against main, all five required trailers present verbatim in the commit body with correct paths; Agent-Id matches the worker identity. Fragile (cosmetic, non-blocking): git's %(trailers) parses this commit as empty because a Co-Authored-By line follows the trailer block — tooling that reads trailers must parse %B instead. The Session-Id trailer (bea9d1c3…) differs from the run ledger's session id (14207a5a…); judged acceptable because the brief sources it from the worker's own environment and forbids fabrication — flagged for orchestrator reconciliation, not a provenance failure.",
  "tooling_notes": "Every shell command emitted a spurious `ld.so: object '/usr/NX/lib/libnxegl.so' from LD_PRELOAD cannot be preloaded (cannot open shared object file): ignored.` line to stderr — an unrelated NX remote-desktop library baked into the environment's LD_PRELOAD, not a repo or task defect. It was harmless noise on every single Bash invocation (git, npm, grep, python3) but never affected exit codes or output correctness. No other tool defects encountered — `gh`, `git`, `npm run lint/test:unit:run/build` all behaved as documented.",
  "handoff_notes": "Deltas vs plan the next phase must absorb: (1) DRIFT (narrow): the plan assumed the stale 'enter the workshop' claim lived only in docs/stage-2/README.md, but docs/audit-2026-09/03-entry-flow-spec.md (not in the brief's Relevant-files list) also carried the false CTA text and the false 'locked button' premise; the worker fixed it minimally (CTA → 'Come on in' → /start, premise marked resolved by Phase 0) to satisfy the brief's own grep criterion. Any later phase that cites 03-entry-flow-spec.md's landing-page snapshot as untouched ground truth must absorb these corrections. (2) Session-Id trailer bea9d1c3-4e0c-4782-b498-a7b45b5dc9ac vs ledger session 14207a5a-9e04-4157-a1e4-d587b0fa917d — worker read its own environment per the brief; orchestrator may want to reconcile the ledger, no action needed on the branch. (3) Trailer parsing: use %B not %(trailers) for this commit (Co-Authored-By follows the block). (4) The 12 lint warnings include .paseo-delegate/capture-*.mjs files owned by the concurrent run; they may disappear or move with that run — do not attribute them to this branch. Worker's tooling note (NX LD_PRELOAD stderr noise) is environmental and bears on no next phase. PR #94 left unmerged per protocol — PR handling is the orchestrator's.",
  "drift": "detected",
  "next_action": "advance",
  "target": "new",
  "next_prompt": ""
}
