{
  "phase": "analytics",
  "verdict": "PASS",
  "gaps": [],
  "assessment": "All acceptance criteria independently verified against the real diff and a from-scratch gate re-run. Emit sites: door_clicked at components/welcome/door-chooser.tsx:87,142; page_created at lib/custom-practice-storage.ts:260 (scratch) and :339 (fork); block_added at lib/custom-practice-storage.ts:292 — all outside lib/analytics.ts and outside __tests__, and the store functions have five real app call sites (components/custom-practice/practice-page-editor.tsx:98, components/custom-practice/command-palette.tsx:60, app/marketplace/page.tsx:95, app/marketplace/[id]/page.tsx:77, app/tools/workshop/blocks/page.tsx:35), so they are not test-only helpers. The store-function placement reasoning holds: two of those callers are app/**/page.tsx files where AGENTS.md bars captureEvent, and hooks/useWorkshopSync.ts:51 confirms Pro pages funnel through the same local store before the debounced upsertCustomDrill push, so one emit point covers Free and Pro. Free-path unit tests (lib/__tests__/custom-practice-storage.test.ts) exercise the store functions directly with no Convex/Clerk mocking; analytics.test.ts proves both no-op-without-key (posthog.capture never called, mirror still updates) and capture-with-key. Gate re-run: lint 0 errors (12 pre-existing warnings), 147 files / 1358 tests passed 0 failures (bar ≥1349), build exit 0. package.json/package-lock.json untouched. app/privacy untouched. Payloads carry only doorId, origin, type — no titles, free text, or email; consistent with lib/sentry.ts's PII scrubbing stance. All four commits carry complete Phase/Agent-Id/Session-Id/Brief/Verdict trailers with repo-root-relative paths; whole-repo tree clean; branch pushed; PR #93 open against main. Solid. Two notes for readers, neither a criterion: appendBlockToPage emits on every append, so remove-then-re-add counts again (fine for a North Star signal); the emit requires captureEvent to stay client-safe — true today since custom-practice-storage.ts is not imported by any Convex bundle, but any future server-side import of it would need re-checking. No existing test was weakened (event-list test still exact-locks the full set; storage and door-chooser changes are additive).",
  "tooling_notes": "A worktree with no local `node_modules` builds fine via the existing `next.config.ts` `resolveProjectRoot()` fallback and `npx`'s upward module resolution — do **not** symlink `node_modules` into a worktree to \"fix\" a missing binary; Turbopack treats a symlink pointing outside the project root as fatal (`Symlink [project]/node_modules is invalid, it points out of the filesystem root`). I hit this, diagnosed it, and removed the symlink before the final build.",
  "handoff_notes": "Deltas vs the plan the next phase must absorb: (1) Door ids are play/build/learn, not play/explore/learn — lib/welcome-config.ts:64 types the union and explore appears only as the build door's color hue in door-chooser.tsx DOOR_TONES; correct any doc/plan referencing door ids. (2) New convention now documented in AGENTS.md: for actions whose real call site is inside app/**/page.tsx, emit analytics from the pure store function it calls instead (page_created/block_added in lib/custom-practice-storage.ts). (3) page_created origin values are scratch | fork; fork fires only when at least one block survives sanitization (negative test locks this). (4) No fourth event was added — the worker found no other call site meeting the brief's one-sentence-justification bar. (5) PR #93 (fleet/analytics → main) is already open; a fix-up push would update it, and the final PASS leaves landing it to the orchestrator. (6) Commit 89c0681 force-added the gitignored .paseo-delegate/analytics/briefs/analytics.md, matching the existing delegate-run tracking pattern; .gitignore itself untouched. Also note the tooling discovery for future worktree phases: never symlink node_modules into a worktree — Turbopack rejects an out-of-root symlink; rely on next.config.ts resolveProjectRoot() and npx upward resolution.",
  "drift": "detected",
  "next_action": "done",
  "target": "same",
  "next_prompt": ""
}
