{
  "phase": "validate-arrangement",
  "verdict": "PASS",
  "gaps": [],
  "assessment": "Independently verified in /home/justin/piano-suite/.worktrees/fleet-agent-surface. AC 4: lib/feature-blocks/validate-arrangement.ts exists, matches the spec's exact ArrangementResult shape, is pure (relative imports only, no React/DOM/fetch, discipline matching target-blocks.ts), and a unit test asserts toEqual({status:'valid'}) proving the typed discrimination. AC 5: one test each for unknown block type (asserts unmet_requirement + 'Unknown component type' detail), orphan transform (rhythmPattern, asserts orphan_transform), and unmet requirement (noteRoll alone) — all pass. AC 6: describe.each is genuinely parameterized — verbose run shows 26 starter templates and 12 marketplace seeds, both suites non-empty, all valid, including pentatonic-improv and pentatonic-scope. AC 7: midiConnectionBar-only page returns {status:'valid'} — regression guard green. AC 10: removal path taken cleanly — grep -rn 'unconsumed_output' across lib/app/components/convex/hooks returns zero hits; registry-parity.test.ts still green (17 tests); the either-outcome criterion is satisfied. Full gate re-run by me: lint exit 0 (0 errors, 12 pre-existing warnings), npm run test:unit:run 148 files / 1390 passed (>= 1349, 0 failures), npm run build exit 0. Provenance: commit a4e871c on fleet/agent-surface, scoped to exactly the 3 phase paths, all five trailers present and correct (Agent-Id/Session-Id match the worker identity), working tree clean, no new repository created, no npm install/ci, no .paseo-delegate writes by the worker, task boundaries (no app/api, no components/*, no hotspot files) respected. The unconsumed_output removal justification was spot-checked: both flagged pages exist (marketplace-seeds.ts:436, starter-templates.ts:676) pairing scaleLibrary with freePlay, whose manifest is registered (manifest.ts:634) — implementing the brief's literal definition would indeed have contradicted AC 6. Solid: surgical diff, honest reporting (pre-existing tsc --noEmit errors in unrelated test files were declared, not hidden). Fragile: the removal decision is empirically grounded in current seed/template content only — any future 'source output goes nowhere' feedback needs a redesigned variant, not a resurrection; and the authoritative spec still shows unconsumed_output in its editor-UI mapping table (see drift).",
  "tooling_notes": "Every shell command in this environment prints `ERROR: ld.so: object '/usr/NX/lib/libnxegl.so' from LD_PRELOAD cannot be preloaded (cannot open shared object file): ignored.` to stderr before actual output. Harmless (NX remote-display leftover env var) but adds noise to every tool call's output.",
  "handoff_notes": "Deltas vs the plan that the next phases must absorb: (1) WiringIssue['issue'] is now the two-member union \"unmet_requirement\" | \"orphan_transform\" — unconsumed_output no longer exists anywhere in code. (2) ArrangementResult's valid branch carries no issues key at all (not an empty array) — callers must discriminate on status, not issues.length. (3) DRIFT: docs/stage-2/phase-2.5-agent-surface/PLAN.md line 192 still lists a `| unconsumed_output | Nothing on this page uses this block's output |` row in the editor plain-language mapping table (and lines 70/74 show the old three-member union) — the editor-wiring-notice phase (AC 8) must drop that row and render only the two remaining variants; the spec doc itself was not edited (out of the validator's remit). (4) blocks-api-route can serialize WiringIssue as-is; no shape change expected. (5) Pre-existing tsc --noEmit errors in unrelated test files (audio-storage.test.ts, custom-practice-storage.test.ts, feature-block-schemas.test.ts, registry-parity.test.ts, music-player.test.ts) were confirmed pre-existing via clean git status — not a regression of this phase, but the finish-gate phase should not be surprised by them if it runs tsc directly (the gate itself does not). (6) Per worker handoff: do not resurrect unconsumed_output with the same definition; freePlay legitimately reads raw MIDI instead of the composed stream.",
  "drift": "detected",
  "next_action": "advance",
  "target": "new",
  "next_prompt": ""
}
