{
  "phase": "finish-gate-and-pr",
  "verdict": "PASS",
  "gaps": [],
  "assessment": "Independently verified at final HEAD 9bc452a in /home/justin/piano-suite/.worktrees/fleet-agent-surface. F1: full gate re-run by me — lint exit 0 (0 errors, 12 pre-existing warnings), test:unit:run 151 files / 1401 passed (>= 1349, 0 failures), build exit 0 with /api/blocks (dynamic) and /tools/workshop in the route table. F2: I re-ran e2e/chat-auth.spec.ts + e2e/auth-protection.spec.ts at E2E_PORT=3355 myself — 50 passed, 1.4m, first attempt, including the signed-in route-smoke tests that timed out for the worker on its cold first run; my clean first pass corroborates the cold-dev-server-compile flake explanation, and the worker's single re-run was exactly the brief's sanctioned procedure (re-run once before investigating; the second run passed outright, so no failure was ever explained away rather than fixed). F3: I re-ran e2e/a11y.spec.ts — 4 passed, 'workshop page reports zero serious/critical violations', threshold untouched; the phase-3 notice markup passed the axe gate. F4: my own production-build curl at HEAD: HTTP 200, cache-control public, max-age=3600, stale-while-revalidate=86400, content-type application/json, body 43,400 bytes — byte-identical to the worker's evidence — 20 components, configSpec on all; my probe server was PID-tracked and killed, port 3360 verified free (I had to kill by child PID: the wrapper-only kill mirrors the pkill self-match trap the worker documented). F5: commit 5028091 adds exactly the three named primitives rows in the table's one-line density style (validateArrangement row even carries the discriminate-on-status convention) plus rule 9 stating the wiring-notice convention accurately (two-member union, guidance not enforcement, issuesByBlockId passed once); AGENTS.md edit is 4 insertions, nothing else. F6: commit 9bc452a contains exactly 17 files, all under .paseo-delegate/agent-surface/, added via scoped git add -f; .gitignore untouched in the whole run range aad873d..HEAD (empty diff). F7: origin/fleet/agent-surface == HEAD (9bc452a); gh pr view 96: state OPEN, base main, head fleet/agent-surface, mergedAt null, not draft. F8: all five run commits (a4e871c, eba02f3, bfe9dfd, 5028091, 9bc452a) carry complete Phase/Agent-Id/Session-Id/Brief/Verdict trailers; the two final-phase trailers match the relayed worker identity. No product/lib/component code was written by this phase (the two commits touch AGENTS.md and the contract dir only); no repo was created; nothing merged; no force-push; no npm ci/install. The worker's 11-criterion checklist restatement cites validator verdicts for the already-verified criteria and fresh HEAD evidence for 1/10/11 — consistent with the brief. Solid: evidence discipline (real output pasted, server cleanup verified in a fresh command), honest flake accounting, AGENTS.md edit matched the existing style exactly. Fragile (flagged, not failing): PR #96 CI and the Vercel preview URL were pending at verification time; README.md and docs/PROJECT_HISTORY.md (spec definition-of-done step 7) were updated by no phase; the contract-dir commit means the tree can never again read clean without deliberate bookkeeping commits — all three are orchestrator-visible open items recorded in handoff_notes.",
  "tooling_notes": "pkill/pgrep self-match trap fired twice (documented; avoided via $! capture + bracket patterns); killing next-server PIDs SIGTERMed the runner shell once (process-group side effect) — end state re-verified clean in a fresh command; no write_file truncation (AGENTS.md edited via anchored python3 insert + git diff verification); first e2e attempt had 5 cold-dev-server timeouts, clean on the brief-sanctioned single re-run.",
  "handoff_notes": "For the orchestrator/fleet closeout: (1) Filing this verdict dirties the tracked contract dir (.paseo-delegate/agent-surface/ is git-tracked since 9bc452a) — one follow-up bookkeeping commit (git add -f scoped, trailers per run convention) is expected; ledger.json/plan.json also carry orchestrator edits uncommitted at verification time, left untouched by me. (2) README.md and docs/PROJECT_HISTORY.md updates (spec definition-of-done step 7, PLAN.md step 7) were done by NO phase — either land them as a small follow-up commit on fleet/agent-surface before merge or record the deferral in the fleet report. (3) PR #96 CI checks and the Vercel preview URL were pending at verification time; the spec's stop condition asks for the preview URL to be printed once available. (4) PR #95 overlap (lib/__tests__/feature-block-schemas.test.ts, one import line + EOF describe block) is noted in the PR #96 body; expect a trivial merge. (5) Nothing merged: main is untouched; the stop condition (all criteria evidenced + PR open) is now met — the run should stop and report. (6) 11/11 plan acceptance criteria carry evidence at final HEAD: 1 (HTTP 200 + 43,400-byte catalogue, re-proven by me), 2-9 (validator verdicts verdicts/validate-arrangement.json, blocks-api-route.json, editor-wiring-notice.json), 10 (S2 grep clean, re-checked this run), 11 (full gate green at 9bc452a, re-run by me).",
  "drift": "none",
  "next_action": "done",
  "target": "new",
  "next_prompt": ""
}
