{
  "phase": "typecheck",
  "verdict": "PASS",
  "gaps": [],
  "assessment": "All acceptance criteria independently re-verified in the worktree, not taken from the worker's report. Baseline reproduced before judging: clean-tree `npx tsc --noEmit` had 53 error diagnostics across the same 13 test files the plan lists (one fewer than the recorded 54; the plan itself says the count may have drifted). After the worker's commits: tsc exits 0 with no output; `npm run typecheck` exists in package.json (scripts block only, additive one-liner, no dependency or lockfile changes) and exits 0; `.github/workflows/ci.yml` gained a `typecheck` job mirroring the lint job's Node 22 / setup-node / npm-ci setup; AGENTS.md's Testing section names the new command and why it exists. `npm run lint` 0 errors (12 warnings, all pre-existing and untouched by the diff). `npm run test:unit:run` 147 files / 1349 tests, zero failures — exactly the plan's recorded baseline, so no test was lost. `npm run build` exits 0. Diff review against the boundaries: zero test assertions changed, zero tests deleted or skipped, and the only production-adjacent edits are the three declared tooling files — `git diff origin/main...HEAD -- lib/drill-runtime.ts lib/audio-settings.ts lib/workshop-grid.ts` is empty and no other production file was touched. The fixes are honest double corrections: `stream: []` added to the four DrillRuntime doubles with realistic values, `onConfigChange={vi.fn()}` added to the grid double, `as const` store literals properly typed as `PracticePageStore`, duplicate data/accessor `onsuccess`/`onerror` keys removed from the IndexedDB fakes, the registry-parity loops typed via `FeatureDefinition<Record<string, unknown>>` rather than untyped, and the deliberately-malformed normalize inputs marked with narrow `as never`/`as unknown as` casts. Provenance verified: both commits carry all five Phase/Agent-Id/Session-Id/Brief/Verdict trailers verbatim (agent/session IDs match the orchestrator's records) plus the required Co-Authored-By; commit scoping is exact (13 test files in eabfddd, 3 tooling files in f65dd6a, no strays); `git status --porcelain` is empty. What is fragile: (1) the worker's BLOCKER is confirmed real — `ValidatedBlock` (lib/feature-blocks/schemas.ts:63-69) omits `size`, while `normalizeStoredBlock` (lines 124-131) attaches `size` at runtime via a conditional spread, so the declared return type under-describes the function's actual output; the worker correctly did not widen it and instead reads size through a documented `sizeOf()` cast in feature-block-schemas.test.ts — this needs a small follow-up phase to add `size?: BlockSize` and keep the declared shape honest; (2) the two malformed-input casts bypass excess-property checking in those specific tests — acceptable and minimal, but they are casts; (3) the worker saw a one-off julia.test.ts random-radius flake pre-commit; it did not reproduce in my full run and is unrelated to this diff, but is worth watching.",
  "tooling_notes": "Every shell invocation in this environment prints a spurious `ERROR: ld.so: object '/usr/NX/lib/libnxegl.so' from LD_PRELOAD cannot be preloaded ... ignored` line before any real output (an NX/X11 LD_PRELOAD artifact from the host shell init, unrelated to tsc/vitest/npm/git themselves) — had to `grep -v` it out of every command's output to read results, but it never affected exit codes or actual tool behavior.",
  "handoff_notes": "Deltas vs the plan the orchestrator and any next phase must absorb: (1) Scope relocation, per the orchestrator's clarification: the operative worker brief excludes push/PR (orchestrator-owned after PASS), so branch `fleet/typecheck` sits 2 commits ahead of origin/main, unpushed, tree clean — the orchestrator pushes and opens the PR as its own next step. Plan AC8's remaining worker-owned halves (trailers, scoping, clean tree) all verified. (2) Counting note: the plan recorded 54 errors; my baseline grep counted 53 diagnostics (single line per diagnostic, files identical) — informational only, zero is the gate. (3) Follow-up recommended (worker BLOCKER, independently confirmed): add `size?: BlockSize` to `ValidatedBlock` in lib/feature-blocks/schemas.ts so the declared return type matches normalizeStoredBlock's runtime behavior; small dedicated phase, plus ideally a type-level guard so the declared shape cannot drift again. (4) `npm run typecheck` is now part of the gate (AGENTS.md Testing section + CI job); all future phases and merges should run it alongside lint/unit/build. (5) julia.test.ts showed a one-off random-radius flake in the worker's session, not reproducible in my run (1349/1349 green); not a defect in this phase.",
  "drift": "none",
  "next_action": "done",
  "target": "new",
  "next_prompt": ""
}
