{
  "phase": "video-arpeggios",
  "verdict": "PASS",
  "gaps": [],
  "assessment": "All eight criteria independently verified against the real artifacts. (1) ffprobe out/demo-arpeggios.mp4: h264 1440x900, 48.042667s (>= 24s, aac). (2) md5 a58ce0956fba88f28a6b992ba0e11b4b identical across out/, dist/, and piano-suite/public/. (3) capture-arpeggios.mjs committed in c5d4050 (268 lines) with Phase: video-arpeggios / Agent-Id / Session-Id trailers (the brief's required three). (4) script-arpeggios.txt is 10 lines, one idea per beat; scenes-arpeggios.json maps them to 9 clips; prior phases' script/scenes untouched. (5) Beat-by-beat OCR at the config-derived segment midpoints (which match the worker's reported midpoints exactly): captions AND Arpeggios UI verified at every one \u2014 t=1.67 'Arpeggios'/'LH pedal (hold): Bb + F + Ab'/'A READY-MADE PRACTICE TOOL IN'; t=5.19 'Bbm11'/'PLAY THE ROOT + 5TH TO BEGIN'/'SEVEN-NOTE MINOR-ELEVEN CELLS, ONE'; t=9.54 'Laps Misses This lap'/'Restart chord'/'HOLD IT, AND THE'; t=14.89 'Connected Demo Keyboard'/'NEXT (11)'/'Holding: F G# A#'/'YOU PLAY IT, AND'; t=20.41 'Laps Misses This lap'/'LAPS AND MISSES ARE'; t=24.59 'RED AND GET COUNTED' (miss flash); t=27.94 'TO THE MISS FILTER'; t=32.29 settings 'Flash on Miss'/'Lap Chime'/'Miss filter'/'Use chord & sequence'/'RESTART THE ONE YOU ARE'; t=37.31 Tracking 'TRANSITIONS Bbm11 - b7Root 10 successful attempts recorded'/'Miss breakdown: played B instead (x1)'/'LOGGED, SO OVER WEEKS'; t=42.66 Tracking chart 'attempt # (chronological) \u2014 10 total'/'FREE. OPEN PIANO SUITE,'. (6) No frozen beats \u2014 per-segment maxYDIF on 32x18 downscale at fps=4: 1.90/11.49/1.68/1.82/1.86/1.85/10.99/12.32/2.06/10.79 (all >= 1.68). (7) Segment fit re-derived from the recorded config: config.generated.ts md5 504d222002d8903bbccf2c64860777a0 == post-gen snapshot cfg-arp-after-gen.ts, and the pre-gen slot snapshot (8cce1182..., the chord-drill config) exists at /tmp/opencode/cfg-slot-before-arpeggios.ts; clips ffprobe 9.72/7.96/11.48/11.48/5.00/5.72/11.48/6.52/9.80 vs hosted segment totals 7.026/5.019/5.688/5.353/3.011/3.680/5.019/5.019/5.688 \u2014 every beat fits with >= 1.99s headroom (min beat5 1.989); 45.504s footage + 2.5s end card = 48.004s = render's 1441 frames. (8) Tree clean: only baseline dirt (docs/quick-fixes-2026-09/, public/demo-web.mp4) plus the orchestrator relay file untracked; demo-web2/demo-chord-drill/demo-arpeggios and contract files all tracked. The adversarial-slot protocol from the chord-drill FAIL was executed exactly (3 regenerations with intermediate defects caught and fixed before render; no clobber). Fragile: the relay summary condenses the beat table to midpoints + fit numbers without the per-beat spoken gist/on-screen action rows \u2014 I derived windows from config.generated.ts sceneSegments (the more authoritative source), so verification was unaffected, but future summaries should file the full table.",
  "tooling_notes": "Regenerated config 3x before the final render: two intermediate generations caught (a) stale scene matches after rewording lines 9-10 (segments dropped to 8 \u2014 caught by counting sceneSegments) and (b) caption-boundary midpoints; final config verified before render, no concurrent clobber observed. My pkill -f \"next dev\" during cleanup was broader than intended: a dev server that had been answering on :3001 was killed (the handoff already reported :3001 dead mid-phase, so it may have been a leftover). The :3000 server/proxy was untouched and is still up. My own :3002 server was stopped intentionally.",
  "handoff_notes": "Chain protocol for video-root-cycling and beyond (all re-verified this phase and working): own dev server on port >= 3002 (BASE_URL=http://localhost:3002, set -a && . ./.env.local && set +a); regenerate src/config.generated.ts immediately pre-render with before/after slot snapshots in /tmp/opencode/ and record the rendered-against md5 in the summary; count sceneSegments after every regeneration; leave >= 2s fit headroom per beat; tesseract psm 11 + band crops; render with --concurrency=2; publish to dist/ + public/ with identical md5. Environment deltas: the shared :3001 dev server is now definitively dead (the worker's cleanup pkill -f \"next dev\" killed whatever was answering there; :3000 is the opencode proxy \u2014 start your own port). Convex cloud (intent-snail-943) serves settings/history; local :3210 dead \u2014 configure drills through UI testids, seed only the tracking localStorage keys. Tree baseline for cleanliness checks: docs/quick-fixes-2026-09/ and public/demo-web.mp4 untracked; demo-web2.mp4, demo-chord-drill.mp4, demo-arpeggios.mp4, capture scripts, and .paseo-delegate contract files are tracked. Process notes for the orchestrator/planner: (a) the relay summaries should reproduce the worker's full beat table (time/gist/action/expected OCR) \u2014 this phase's relay condensed it to midpoints + fit, forcing the validator to derive windows from config sceneSegments instead; (b) workers still file no summaries JSON \u2014 consider requiring summaries/<phase>.json so beat tables survive; (c) commits c5d4050/82f7899 carry the three trailers the planner-authored briefs require, not the five the welcome-video brief required \u2014 keep the planner briefs explicit about which trailers each phase needs.",
  "drift": "none",
  "next_action": "advance",
  "target": "new",
  "next_prompt": ""
}