{
  "phase": "launch-smoke",
  "verdict": "PASS",
  "gaps": [],
  "assessment": "Solid: the report exists at the exact required path and every checkable claim reproduced under my own hands. I re-ran `npm run lint` \u2192 `\u2716 13 problems (0 errors, 13 warnings)` and `npm run test:unit:run` \u2192 147 files / 1349 tests passed \u2014 both byte-match the report's recorded numbers, and the warnings table matches the actual lint output I saw in phase 1. The report records all four suites in order with real numbers and an explicit '**Ready**' conclusion; no suite failed, and the worker still preserved the non-fatal console warnings verbatim rather than hiding them \u2014 exactly the truthfulness the brief demanded. Provenance is clean: commit 71c6b68 touches only the report (139 insertions), carries all five trailer lines with this phase's real agent/session ids, and `git diff 97a45be..HEAD -- app/ lib/ components/ hooks/ convex/ package.json` is 0 lines \u2014 no application source modified. Tree is clean and `main` == `origin/main` at 71c6b68. Environment claims corroborated independently: `chromium-1234` is in ~/.cache/ms-playwright, and pid 584 (`node proxy.js`) really holds port 3000, so the documented `E2E_PORT=3001` workaround is genuine and consistent with playwright.config.ts's E2E_PORT support. Fragile: the 'ready' verdict rests partly on the e2e run I could not reproduce cheaply \u2014 but its log is specific (4 passed, per-test timings, named spec lines), internally consistent, and the app code it exercised is unchanged since; the recorded follow-up debt (getServerSnapshot caching warnings, Clerk UserButton hydration mismatch, Sentry deprecation) is real but non-blocking.",
  "tooling_notes": "Port 3000 on this machine is held by an unrelated `opencode` proxy (pid 584), so e2e ran on the config's supported `E2E_PORT=3001` path instead of the default. Playwright dev-server console surfaced three non-fatal app warnings (recorded in the report for follow-up): `getServerSnapshot should be cached` at `practice-page-editor.tsx:68` and `workshop/blocks/page.tsx:25`, a hydration attribute mismatch in the sidebar's Clerk `UserButton`, and the Sentry `disableLogger` deprecation. No suite failures \u2014 nothing to quote verbatim.",
  "handoff_notes": "Final phase \u2014 run complete: three of three phases PASS, `main` at 71c6b68 == origin/main, tree clean, run verdict 'ready for free-tester launch'. Deltas for the record: (1) follow-up debt captured in the report \u2014 the `getServerSnapshot should be cached` warning (components/custom-practice/practice-page-editor.tsx:68, app/tools/workshop/blocks/page.tsx:25) is worth a sweep (extra re-renders), plus the sidebar Clerk UserButton hydration mismatch and the Sentry `disableLogger` deprecation. (2) Environment: local dev on port 3000 collides with the unrelated opencode proxy (pid 584) until it is stopped or moved; e2e must use E2E_PORT=3001 meanwhile. (3) Carried from phase 1: production robots/sitemap emit localhost URLs unless NEXT_PUBLIC_SITE_URL is set in Vercel. (4) Provenance gap to remember: phases 1\u20132 commits carry `Agent-Id: unknown`/`Session-Id: unknown` trailers (brief-sanctioned fallback); ledger.json holds the authoritative ids. No plan premise broke at any point.",
  "drift": "none",
  "next_action": "done",
  "target": "new",
  "next_prompt": ""
}
