{
  "phase": "seo-basics",
  "verdict": "PASS",
  "gaps": [],
  "assessment": "Solid: all four deliverables verified in the actual diff and build output, not the summary. robots.txt.body contains 'User-Agent: * / Allow: /' plus the sitemap line; sitemap.xml.body contains exactly the 13 public routes the brief lists from proxy.ts (/, 4 drills, /tools/workshop, /tools/workshop/blocks, /start, /marketplace, /routes, /pricing, /terms, /privacy); _not-found.html is prerendered and not-found.tsx uses only theme tokens (text-primary, text-foreground, text-muted-foreground, font-heading, measure-number) \u2014 no hex/rgb literals; app/layout.tsx gained title.template '%s \u00b7 Piano Suite' with default 'Piano Suite' and nothing else changed in that hotspot. APIs match node_modules/next/dist/docs for next 16.2.12 (robots.md Robots object, sitemap.md Sitemap return, generate-metadata.md template requiring a default). I re-ran the gate myself: npm run lint \u2192 0 errors (warnings only), npm run test:unit:run \u2192 147 files / 1349 tests passed, npm run build \u2192 passed. Single commit ff14615 scoped to exactly its 10 files, on main == origin/main, carrying the brief's four provenance trailers (Agent-Id: unknown is the brief's explicit fallback; ledger.json independently records the real worker agent/session ids), no new dependencies, no hotspot files touched beyond the brief's own, delegate worktree removed. git status --porcelain shows only the two untracked paths this brief explicitly forbade touching \u2014 pre-existing state that Phase 2 exists to resolve. Fragile: sitemap is a hand-maintained list that will silently miss future public routes; production emits localhost sitemap/robots URLs unless NEXT_PUBLIC_SITE_URL is set in Vercel; the six title-dedup edits are metadata-only and correct, but future pages must now set bare titles.",
  "tooling_notes": "The shell emits harmless `LD_PRELOAD` libnxegl warnings on every invocation (environment artifact, not this work). No tool defects.",
  "handoff_notes": "Deltas the next phase must absorb: (1) title.template is now the single writer of the brand suffix \u2014 future pages set bare titles ('Pricing', not 'Pricing \u00b7 Piano Suite') or the suffix doubles. (2) The tree is clean only modulo the two Phase-2-owned untracked paths: docs/quick-fixes-2026-09/ (commit as-is) and public/demo-web.mp4 (gitignore via /public/demo-web.mp4, keep on disk); Phase 3's report path lives inside docs/quick-fixes-2026-09/ and works only after Phase 2 commits it. (3) Sitemap/robots read NEXT_PUBLIC_SITE_URL with a localhost fallback \u2014 must be set in Vercel for production. (4) proxy.ts's runtime allowlist is broader than the brief's 13 sitemap routes (also /articles, /dev, /sign-in, /sign-up, /api, legacy /workshop, /tools/chladni) \u2014 per brief scope, but noted for future sitemap upkeep. (5) Worker's tooling note bears on every later phase's shell output: the shell emits harmless LD_PRELOAD libnxegl warnings on every invocation (environment artifact, not this work). No plan premises broke; phases 2 and 3 proceed unchanged.",
  "drift": "none",
  "next_action": "advance",
  "target": "new",
  "next_prompt": "# Task\nResolve the two untracked items at the root of /home/justin/piano-suite so `git status --porcelain` is empty: commit the documentation directory, and gitignore the demo video without deleting it from disk.\n\nFirst run: `cd /home/justin/piano-suite`\n\n# Context\nPiano Suite (Next.js 16 + Convex + Clerk) is being prepped for a free-tester launch. This is phase 2 of a three-phase launch-prep run; phase 1 (SEO basics: app/robots.ts, app/sitemap.ts, app/not-found.tsx, title.template) is merged to main at commit ff14615. Exactly two untracked paths remain at the repo root and this phase owns both.\n\n# Relevant files\n- `/home/justin/piano-suite/docs/quick-fixes-2026-09/` \u2014 untracked documentation directory. Review its contents for orientation, but commit them exactly as they sit on disk; do not rewrite.\n- `/home/justin/piano-suite/public/demo-web.mp4` \u2014 untracked demo video binary. Repo bloat; it must never enter git history.\n- `/home/justin/piano-suite/.gitignore` \u2014 append the mp4 entry here.\n- `/home/justin/piano-suite/AGENTS.md` \u2014 project conventions (theming, commits).\n\n# Output format\nOn `main` in the existing repository at /home/justin/piano-suite:\n1. `docs/quick-fixes-2026-09/` fully tracked in a commit, contents untouched.\n2. `.gitignore` gains an entry for `/public/demo-web.mp4`.\n3. `public/demo-web.mp4` still present on disk, absent from git history.\n4. Commits pushed to `origin/main`.\n\n# Tool and source guidance\n- Work directly in `/home/justin/piano-suite`. Do NOT create a git worktree for this phase: the two untracked paths exist only in the main checkout, so a fresh worktree would not contain them.\n- Scope every `git add` to explicit paths (`docs/quick-fixes-2026-09`, `.gitignore`). Never `git add -A`.\n- After committing, verify `git status --porcelain` is empty, then `git push origin main`.\n- No application source files change in this phase; the deliverable is git state, not code.\n\n# Task boundaries\n- Do not modify, reformat, or \"improve\" anything under `docs/quick-fixes-2026-09/`.\n- Do not delete or move `public/demo-web.mp4`; it must remain on disk.\n- Do not touch any other file; do not create a new git repository; do not force-push.\n\n# Effort budget\n~30 minutes. If blocked past that, report STATUS: blocked.\n\n# Acceptance criteria\n- [ ] `git status --porcelain` is empty at `/home/justin/piano-suite`.\n- [ ] `docs/quick-fixes-2026-09/` is tracked in git history, committed with its on-disk content.\n- [ ] `public/demo-web.mp4` still exists on disk and does NOT appear in git history (`git log --all -- public/demo-web.mp4` is empty).\n- [ ] `.gitignore` contains an entry for `/public/demo-web.mp4`.\n- [ ] `main` is pushed: `git status -sb` shows `## main...origin/main` with no ahead/behind.\n- [ ] Every deliverable-changing commit carries the provenance trailers below.\n\n# Constraints\nEvery deliverable-changing commit message ends with these trailers (fill in your agent id and session id from your spawn context; write `unknown` if truly unavailable):\n\n```\nPhase: repo-hygiene\nAgent-Id: <your paseo agent id>\nSession-Id: <your session id>\nBrief: .paseo-delegate/briefs/repo-hygiene.md\nVerdict: .paseo-delegate/verdicts/repo-hygiene.json\n```\n\n# Completion contract\nYour final chat message must be your completion summary:\nSTATUS: complete|blocked|failed\nSUMMARY: ...\nFILES CHANGED: ...\nVERIFICATION: ... (exact commands run and their results)\nBLOCKERS: ...\nTOOLING NOTES: ... (defects/surprises in the tools themselves \u2014 the CLI, the test harness, the build \u2014 distinct from your own work; \"none\" if none)\nHANDOFF NOTES: ..."
}
